1,"Perhaps you haven't heard, there was a detailed study of what factors most influence murder rates, guess what, access to   abortion   was number ONE.  The problem is that having babies stresses families who already have limited resources.  Further, it doesn't make sense to expect young men and women to be perfect reproductive human beings, then when  they make a mistake to  require them  to have a child.   (We  are programmed to reproduced; that's  how our specie survived.)  And, by the way, you only get 2 years of welfare because we don't want to pay for your mistake.Didn't Jesus say something about forgiving sins?"
1,"If anyone really believed that abortion is murder, he or she would be advocating the same penalty for women who choose to have abortions as the law prescribes for anyone else who is guilty of premeditated murder: twenty-five years to life, ususally.  I have never heard anyone call for that, or any punishment whatsoever for women who abort.  Therefore, it is logically inescapable that no one really believes a fetus is the same as a child, no matter what they claim to believe."
2,"According to your reasoning:If anyone really belived death penalty is murder, he or she would be advocating the same penalty for those who carry out/sentence the death penalty as the law prescribes for premeditated murder.I honestly don't believe that those opposed to the death penalty want jury members, judges, and law officials to be jailed over it. They simply want the option off the table.  The same is true with the abortion issue.  Your argument once again tries to make abortion solely a women's rights issue when those who oppose it are heart-broken over the loss of innocent life.  I will never accept the pro-choice point of view, but I can oppose it without labeling pro-choicers as murderers.  "
1,"Abortion does not negatively affect a woman's sexual functions A study conducted at University of Copenhagen has shown legal abortion is associated with few adverse effects on sexual function among women in Denmark.
"
1,"“According to your reasoning:??  “If anyone really belived death penalty is murder, he or she would be advocating the same penalty for those who carry out/sentence the death penalty as the law prescribes for premeditated murder.”Correct.“I honestly don't believe that those opposed to the death penalty want jury members, judges, and law officials to be jailed over it.“Why not?“They simply want the option off the table.”That cannot be accomplished, without punishment.“Your argument once again tries to make abortion solely a women's rights issue…”No, it doesn’t.“…when those who oppose it are heart-broken over the loss of innocent life.”Then why don’t you want the killers punished?“I will never accept the pro-choice point of view, but I can oppose it without labeling pro-choicers as murderers.”If the takers of innocent life are not murderers, what are they?  And what, then, is a murderer?With all due respect, I think your contradictions make my point."
1,"is not the same as the right to life, as I have argued elsewhere on this thread. One does not treat an acorn as one treats an oak tree. One does not treat a four-year-old as one does a teenager.  Development does count.Yes, our lives begin at conception, but what we do with them comes after entering the world and it is that ""doing"" that counts for the moral judgement of 'innocent.'  A fetus is no more innocent than it is guilty. The ""doing"" is also largely what we are beyond a collection of dna. God may judge people on the basis of nothing more than their DNA(though the Bible would seem to be evidence to the contrary) but to say that ""doing""  counts for nothing then perhaps we should revise our moral judgement of men like Hitler, etc.The truth is we are not passing judgement on the fetus, we are not considering their innocence or guilt, we are making a judgement about the place in our lives of an as-yet unborn fetus (I mean the first-trimester).  We are examining our abilitities, our life's goals, our financial prospects and current state, perhaps even whether this is a world ready for yet another mouth to feed --in short we are examining the wisdom of having and raising a child, not only by ourselves but others (I gave my daughter up for adoption when it was the only alternative to raising her myself, whch I could not realistically expect to do. I can't tell you how much I regret the abuse she recieved at their hands).Only someone that believes that what we Do counts for nothing could believe that the choice of a woman excercising her judgment counts for nothng against the dictates of you and your God."
1,"The anti-abortionists use one sloppy, cheesy phrase written in one unprofessionally written textbook used in third-rate medical schools as ""scientific proof"" that human life begins at conception.Such argumentation represents a wholesale rejection of reason and a hostility to actual science. It is a cynical ploy that convinces no one outside of evangelical circles. The evangelicals use it in the vain hope that somebody's say-so will vanquish others' will to think critically."
2,"Unless you were raped or it's a threat to your life I believe it's wrong to be allowed to end a life just because it's an inconvenience to you. If that were the case,keep your legs crossed and you won't have that problem!!!"
1,"Why don't we make you the head of decision making for all the girls who seek abortions. You can go and hear all of their stories and decide who can and who can't get abortions. You can determine whether or not they are doing it for convenience or not. I am sure that all the girls who are out there were thinking...""I am definitely going to get pregnant and have an   abortion  . That sounds like a great idea."" By the way, why do people have   kids  ? To continue their bloodline? To get some guy to finally put a ring on their finger? Because babies are sooooo cuuuute? Don't act as though women who decide to have kids are altruistic saints who should be put on a pedestal and worshipped. Even cockroaches have kids.The world is overpopulated. Keep your legs crossed. "
1,"According to the logic behind this argument as to why a woman should have no legal control over her body parts, you and I have committed murder, or man-slaughter.There are thousands of innocent children who are dying everyday through lack of such a simple thing as a functioning kidney, or bone marrow.  When you choose to retain your body parts, or choose to not undergo a painful process you are killing those children through your inaction.  If you know that a child will die and you do nothing to prevent it, you have murdered that child.  According to the logic that a woman must give up control of her body parts for the sake of saving a life, all people must do so.  If   abortion   should be illegal, so also should non-compliance with other medical procedures that can save lives.  "
1,"Why should it be illegal? Would you take away the choice for a 13 or 14 year old girl who was raped? Yes, there is giving it up for   adoption  , but it is the fact that a child will have to carry a child. I do think that it shouldn't even be an option for older women, because it is, usually, their own fault they're pregnant in the first place. Also, what do you think when you see a pregnant 20 year old versus a pregnant 14 year old? It won't hurt anyone older to carry their child. The only acceptable times for an   abortion   are rape and if carrying the child could kill or harm you severely. "
1,"The points you make here seem to be as follows:- Regulations on abortion clinics are sometimes inadequate or ill-enforced.- Some women experience complications.- Some women have regrets after having abortions.These are real issues, but they shouldn't be dealt with by banning abortion. We should make sure abortion clinics can't weasel out of important safety regulations, that's clearly true. Every medical and surgical procedure has complications, so patients need to be adequately informed of possible risks -- this is true even of things like wisdom teeth extraction or appendectomies, but surely you wouldn't advocate banning those. Finally, some people wish they hadn't done it? That has never, in the history of our country, been an adequate reason for banning something. You might as well ban ugly ties and disco music."
1,"I find it very difficult to see how you describe your position as ""real choice"" when you do not want there to be a choice at all. "
2,"Are proponents of elective   abortion   facing the moral complexity of this issue?  A baby's life is at stake, here.The news yesterday was that babies dance to music in utero (in the womb).  Did you know that baby boys in the womb are often seen to grow erections, when the ultrasound video goes on (as if they somehow know that they are being observed; so something)?Why not Domestic Violence and murder?  After all, Rihanna is HIS (Chris Brown's) girlfriend; isn't THAT what spouses and boyfriends and girlfriends reason?When are these bloody, black shadows going to leave our beloved land, and that high, bloody, black hand which makes those shadows, as well?"
1,"Abortion is no more risky or harmful than ordinary birth. While abortion has it's risks, it's important that we compare it against the alternative, which is going through with giving birth. This probably entails just as many risks, if not more, as an abortion.
"
1,"and mention Rihanna and Chris Brown. Is there something about your view of   abortion   as it relates to people of color that you want us to know about?I have a little plant on the dashboard of my car. It dances when the music plays. It is not alive.I have a little wooden statue that my brother gave me, where when you take the wooden barrel off of it, it pops an erection. My brother has no sense of humor. But that object is not alive."
2,"Did I keep saying ""black""?Sorry, then, about the mis""conception"" (sorry).When I said black, I meant ""onerous"", deadly, foreboding.Even the first, one cell, already has the entire, human chromosome contribution from both dad and mom and it's dividing to reach the first goal of birth.  At eighteen days, there are brainwaves.  There are heartbeats before the mother knows (Latin: ""little one"") that she's pregnant.65% of Americans, even   pro-choice   Americans, believe that a human life is taken in   abortion  , Cameron.  An abortionist I debated once on a radio program said: ""Of COURSE I know that it's human.  What do you think that I think it is, a TOMATO""!Why dehumanize the ""little one""?  Didn't dehumanization happen to a people in the early Twentieth Century on Earth (where and when I spent most of my life, so far)?and, when I used the word: ""foreboding"", earlier, I meant to.Did you know that the medical profession had already murdered over 250,000   children   with ""defects"" (some as slight as mis-shapen ears), while Hitler was still a Corporal, recovering from a war wound in the Veterans' Hospital?Hitler didn't start the killing.  He just took it over.  In the end, he said: ""Europe will stand up and thank me, for eliminating the defective from the gene pool"".  Like almost everybody in the world, Hitler believed in Darwin's ideas of some peoples being inferior to other.  Hitler really meant what he said; and, explicitly.Anyway, don't shrink from the moral complexity, Cameron.  Even Obama (the most pro-choice of abortion President in American history, to-date) admitted that much (the outright humanity of the human fetus); and, if I'm not mistaken, he used a term I've used, ""moral complexity""early during  his first News Conference.raymond"
1,I don't have a right to engage in sexual intercourse and then later insist that my rights were violated because the woman used protection. It's not a violation of my rights for a woman to refuse to have sex with me unless there's birth control involved. We do not have a right to procreate.
2,"I believe that you may be correct in the case of a few dictators in human history; but, it would have to be a pretty overwhelming and controlling government which would take away its slaves' opportunity to procreate by   law  ."
1,"Here's a great example of the difference between a positive and a negative right.Stating this right in a positive way would be saying:I have the right to procreate.or more specificallyI have a right, as a male, to decide what happens to any individual created using my sperm.Which is a weird right, but okay. Let's go with that.Firstly, is it a codified right? I can't think of anywhere that such a right is stated or implied, unless you count your genetic offspring as property.Is it a natural right? Unlikely--people who give up their   children   for   adoption   and later want access to them, and have that refused, don't have their rights violated. Sperm or egg donors do not have their rights violated if they don't get to name\provide\have a say in their offspring's life.So let's look at the negative right statement, ie.No one should have the right to impede my procreationOR MORE SPECIFICALLYNo one should have the right to disallow my choosing to decide what happens yadda yadda yaddaThis right could be applied to the government, or to the general populace.Now, I agree that the government cannot and should not mandate abortions, forced sterilizations, etc, like many governments have done (including the US). However, that's not what's happening. The government simply makes the option available, like any other medical procedure. It provides them some funding, since it's difficult to train   doctors   in such a procedure unless you're dedicated to it, and operating an   abortion   clinic as opposed to a plastic surgery clinic is about six times as expensive, to protect it from   terrorism   by extremists.So at last we have the ""No one should have the right to disallow...""This is almost an eerie return to biblical morality. Not the good kind, where there's love and feeding of the poor--the scary kind. Rapists are forced to marry their victims kind. Does a rapist have the right to impede the abortion of the woman he's raped? Does a man or a woman have the right to force his involvement on his child, if a court order prevented it?"
2,"As in the past, you present a thoughtful question.  I will think more about this.For now, I will just ask ""What is Natural Law?"" and have we rights, after all, which are ""given us by our Creator, such as Life, Liberty and the pursuit of happiness?""Does that still have meaning, today?  And, if not, then are we ""in the soup"" or not?"
1,"But it's beyond the court of the land to enforce them.If a woman chooses to have an   abortion   performed, that falls under liberty AND pursuit of happiness, wouldn't it?"
2,"Yes.  Now.  Because   abortion   is now considered a ""right"", it is beyond the court of the land to enforce it.But don't you argue that the court (the State) can violate Natural Law?  Shouldn't the court violate the right to elective abortion?I more than that look upon the ""little one's"" right to life.  If we haven't a right to life, then of what value or usefullness are other ""rights"" (the right to free expression becomes possibly the right to verbally object within the scopes of firing squads?I've tracked down my old friend of a decade ago.  Here's some info about him.  It's dated, so I must phone him soon.      Stephen D. Schwarz Department of Philosophy 170 Chafee Social Science Center 10 Chafee Road University of Rhode Island Kingston, RI 02881 Phone: 401-783-8265 E-mail: Stephen Schwarz    --------------------------------------------------------------------------------  Stephen Schwarz is Professor of Philosophy.  He received his BA and MA in Philosophy from Fordham and his Ph.D. in Philosophy from Harvard.  He joined the department in 1963.  His research and teaching interests are mainly in ethics, metaphysics and epistemology.  He received an Award for Excellence in Undergraduate Teaching in 1971.  He is now in phased   retirement   (half the normal teaching load), and will retire officially in 2007, but hopes to continue teaching after that, one or two courses a year.His major publications include:The Moral Question of Abortion.  Chicago: Loyola Press, 1990, 1992.“Love of Truth as a Moral Virtue,” in Stephen Schwarz and Fritz Wenisch (eds.), Values and Human Experience: Essays in Honor of the Memory of Balduin Schwarz. New York: Peter Lang, 1999.“The Right and the Good: Two Fundamental Dimensions of Morality,” in Aletheia, vol. V (1990), pp. 59-76.“Faith, Doubt and Pascal’s Wager,” in The Center Journal, vol. 3, no. 3, Summer 1984, pp. 29-58.“Does Prichard’s Essay Rest on a Mistake?” in Ethics, vol. 81, no. 2, January 1971, pp. 169-80.Professor Schwarz regularly teaches PHL 212, Ethics and PHL 342, Knowledge, Belief and Truth.      Copyright © 2005University of Rhode IslandDisclaimer    -------------------------------------------------------------------------------- File last updated: Tuesday, December 13, 2005 The University is an   affirmative action  /equal opportunity employer.  All rights reserved. URL:   http://www.uri.edu/artsci/phl   "
1,"You have to look at the concept of natural   law  , and what would allow those rights to be violated. Do the laws of the state have the right to violate those natural rights?I'd argue that yes, they do.There may be natural law, but there isn't a natural law that states, for example, that, oh, you can't smoke   marijuana  . I think you'd be hardpressed to find someone who believes that is a natural law. However, the state can imprison you for doing so, thusly infringing on your Natural Right to liberty, and the pursuit of happiness.There's no Natural Law that says you have to be loyal to your country, but the State has the right to kill you if you commit treason, violating your Natural Right to life."
2,"He should not have reversed something that was voted, and reflected the will of the majority. THAT should never be allowed in a true democracy. We are moving away from being one every day."
2," Abortions are very risky and hazardous to the women Warren Hern, abortion practitioner and author of Abortion Practice (1990), the textbook most widely used in the United States to teach abortion to medical personnel - ""In medical practice, there are few surgical procedures given so little attention and so underrated in its potential hazard as abortion.""
"
1,Here is a link to a site with all the major polls from news agencies and polling entities.  http://www.pollingreport.com/abortion.htm  You find that the majority of people do not share your views. 
2,"Fox news polls usually come out leaning conservative, MSNBC polls come out leaning liberal - surprise, surprise...not!"
1,"In most of the polls pro life and pro choice are statistically equal.  I saw no big surprises from any of the polls in the way you put it, except for the fact that even most of the people FOX polled still came out in favor for abortions in various situations with the exception of using it for unwanted pregnancies. None of the so called ""liberal"" news organizations established anything near a majority for pro choice.However, given that the majority of people do allow for a range of exceptions where   abortion   is permitted, Obama's repealing of the MCP brings how the federal government gives financial aid around the world more in line with the view of our citizens. The MCP established a false majority, in favor of the pro life ideas, this clearly not the case in the polls nor by the votes. Don't forget the couple of states who put legislation, trying to either restrict abortion or to do away with it entirely, to the vote in the last presidential election were defeated.Repealing the MCP just puts thing back to the equal footing between the opposing sides that existed before default status was wrongly given to the pro life side."
1,I think it should be a choice for the person facing the question and noone esle business.I personally don't approve but that don't mean jane doe shouldn't get one if  you don't approve don't get one!!!where do  you stand on my opinion???
1,"I share your views, I also think it is one of those questions that only the person involved can make based on a personal level. This is why I always defend choice."
1,Sounds like a fair man|women there that is one thing that makes this country great because we can make choice's  and I am glad to hear someone agree with me I tip my hat to ya....thank ya
1,"The gag rule was put in place by Reagan, kept by Bush Sr., reversed by Clinton, put back by Bush Jr., and reversed again by Obama. It just alternates as the Republicans and Democrats exchange control of government. If you think the will of the people is important to listen to, you should agree with the reversal -- the people elected a Democrat, and reversing the global gag rule comes along with that."
1,"What are you talking about moving away from a true   democracy  ,in a democracy you are alloud to make chooses for yourself in this case someone esle is making it for you. I Personally do not approve of   abortion   that don't mean I can decide for someone esle and niether should you or anyone esle!!! It's should be the single person choice!!!"
2,"I just made a long call to the Family Research Council in Washington DC, I was interested in possibly supporting them, I agree on many of the positions they claim to represent.  I am setting here very disappointed, to use mild comparisons they appear to be modern day Pharisees and Sadducees.  For you non   Christians   they may be people who have hidden motives and are not who they claim to be.  It is impossible to determine who or where there funding comes from.  For all we know they could be funded by interests in China who wish to have much more control over the USA.  The Fact is we just don’t know who the   money   comes from or if they have hidden motives.  Do any of you know exactly who there money comes from?  Please don’t use the Evangelical Council as a resource to find more on this subject, you will get only general meaningless data from them.  How about it Family Research Council, give us a list of your top twenty contributors and there amounts."
2,"Odd, that in our bad economy that we can't find money for alot of things but we can find money to kill children. That money has been stored since Bush did the right thing 8 years ago. That money should have gone to things like homlessness or how about the foster care system. "
2,"Preventing ""back alley"" abortions are no reason to legalize abortion. That the illegality of abortion may lead to back-alley abortions is not a reason to legalize abortion. This argument has nothing to do with the core moral principles underlying the debate (regarding life and rights), so should not be considered. 
"
1,"Actually, reversing the ban doesn't change how much money the program takes up. It just makes more groups and places eligible for funding. Those places aren't performing abortions 24/7, you know. One might say it's pretty inhumane to deny funding to a medical organization because, in addition to providing malaria nets and polio vaccines and clean drinking water, they are also willing to perform abortions. Funding should go to the groups best equipped to spend it most efficaciously, regardless of whether they sycophantically agree with the entire conservative Christian agenda."
2,The thing has been growning by 40 mill every year since it has been gagged. I am saying the money shold have been used some place else. You don't have to agree with the Conservative Christian ideaolgy to agree abortions are wrong. 
1,IT should be a choice of the person facing that question not your I don't approve of   abortion   that don't mean it should be that way we live in a country of free choices if you don't believe don't go get one!!!!
