1,"I have read your responses in various places. Thank you for being so thoughtful regarding this subject. If the question was precisely defined we might come to terms. They talk about the issue of   abortion   and then ask a nonsensical question, which needs to be interpreted in a context before it can be answered. My various posts, which you have responded to, have been themselves responses. The context has varied somewhat between philosophical, scientific, and legal.The theme to my thoughts is that I deny that there is a singularly important event in the life cycle of humans. We are Homo sapiens at every point and alive at every point. The parts of us that are new and unique appear at several different places in the cycle.In moral terms, I argue that it is morally wrong to purposefully destroy a fetus at any stage. However, I deny that a fetus is equal at every stage. The wrongness increases as we acquire the parts that make us unique, complex, and eventually sentient.If I was arguing for conception as THE start, I would begin with a nasty question: What is the first stage of human development called, and when does that stage begin? Many people will answer zygote and you will have them. However, the correct answer is gamete - beginning at meiosis. We have a brief haploid period in our life cycle, which occurs at the very beginning of human reproduction. Gametes are as independent from their parent as a fetus is, so there is still the question about whether they are really distinct or just a part of the parent. Random events in meiosis lead to a unique genetic make up for each gamete. Another random event (which egg and sperm join) leads to a zygote with a unique make up. Zygote is the first diploid stage. So, if the question at the top was, ""When does the first diploid stage of human life begin?"" the answer would be, at conception. Aside: Now I could be belligerent and mention that when a human begins to burn resources on reproductive structures that is really the beginning - the point where a human starts preparing the next generation. This illustrates the nature of a cycle, there is always something before.This discussion of beginnings simply does not help with the broader question of abortion. The ideologues on both sides of the abortion issue want an answer that leads to a legal result. They both want to create the binary situation that I argue against - the worthless/important dichotomy as you aptly describe it. In the absence of people trying to make this dichotomy you and I would never have had this discussion. The minor distinctions between being a sperm with the potential to be human and simply being a live human would be an esoteric subject."
2,"ONE:You wrote, ""I deny that there is a singularly important event in the life cycle of humans. We are Homo sapiens at every point and alive at every point. The parts of us that are new and unique appear at several different places in the cycle."" I wonder if it is within the purview of science to identify a ""singularly important"" event.  Wouldn't ascribing importance require the abandonment of science's claims to objectivity and detachment?  If we are homo sapiens at every point, then shouldn't science merely identify the earliest point as the beginning?  If a neurologist assigns importance to when neural activity begins, then that is appropriate given his field- for that is what is important _in_his_context_.  Life without neural activity is not particularly significant (except as it affects life that does) in his field.  Nonetheless, a scientific determination of when something begins shouldn't deal with what is important.  It should deal a beginning in terms of what is earliest.  Do you disagree?  Do scientists find it hard to come to a consensus about when life begins for fruit flies?  I think that you said that you were a biologist.  I'm sure that you said that you were a scientist.  If you say that there isn't a consensus on fruit flies, then I'd like to hear more. If they don't, then it seems that humans are probably treated differently as a result of importing philosophy (my chosen field) into science (yours)?  Fruit flies are hard to invest with much importance.  We talk about ""humanity"" being a quality in a way that is not equivalent to the quality of being ""a member of the species homo sapiens sapiens"".  There is no equivalent quality of ""fruitfly-ity"".Sexual reproduction seems to have a pretty clear starting point. Eukaryotes get kind of hazy- where does the parent cell leave off and the daughter cell start?"
1,"Assigning a beginning is trivial from a distance and gets harder the closer you look. In some ways it is even more complex with fruit flies than with humans, since nurse cells with maternal genetics govern the development of the early embryo for quite a while before the genetics of the embryo take over. There is no scientific need to define the beginning of something more broadly than for the experiment that you are conducting. When wildlife biologists count gazelles they choose a definition that works for them. When neurobiologists study neural development they wait until some point in development when a particular event happens. This question (when does life start?) is not a scientific one. I am a scientist, but I am not claiming to have authority regarding the issue, except where others make a false claim of scientific conclusion.With regards to the simple firsts, meiosis is the first event that gives rise to a unique genetic combination that will become part of a new person. Conception is another later event that can be described the same way. Conception is special, because pregnancy is special. All pregnancies have emotional importance to the people involved and should be viewed as having a moral 'worth.' That is why we should work to reduce abortions. This is an issue of law and society, not science."
2,"TWO""If I was arguing for conception as THE start, I would begin with a nasty question: What is the first stage of human development called, and when does that stage begin? Many people will answer zygote and you will have them.  However, the correct answer is gamete - beginning at meiosis.""Well, that is kind of funny to me in a way.  I'm   pro-life   but an atheist, and pro-life atheists get annoyed when they're arbitrarily lumped together with religious fundamentalists.  Someone asked me (around the time of the election when Palin caused talk of abortion to spike) how I could be an atheist and be opposed to contraception.  I said that that was a stupid question because ""I don't care what people do with their gametes"".  I told him that the government could put condom dispensers on every street corner and I'd mostly be concerned about it leading to more littering.Gametes aren't humans.  They are human cells, but I'm sure you'll agree that's saying a different thing.  A fertilized egg is a human cell too, of course, but with a difference: that single cell grows until it is indisputably a human being.  No gamete ever does.  That is why a human life begins (starts to grow into an adult human) immediately after conception.In the abortion debate, pro-choicers like to say that a fetus isn't a person, but merely a _potential_ person.  (Of course, they reserve the right to define ""person"" to themselves!)  Two gametes are a potential human if one is a sperm and the other is an egg.  If they're both sperm or both, then you don't have any potential humans.  You've just got human parts.  A chlorine atom isn't (table) salt, and neither is a sodium atom.  You need both, and you need them to bond before you have salt.  A sperm and an egg are analogous to the chlorine and the sodium.  Until you get both, you only have pieces.  Until the two fuse, you may have a full set of pieces, but that's _all_ you have.  When I was younger I took apart a calculator once.  I still had all of the parts, but I didn't have a calculator anymore    :)"
2,"Gametes may not even be alive.  I don't know if scientists use a significantly different approach, but in philosophy we occasionally discuss what is alive and what is inanimate, and I'm not sure that gametes qualify.  We talk about ""live sperm"" sometimes but electricians talk about wires being ""live"" too.  Sperm are motile for a period of time, but so is a lizard's tail.  It might be ""live"" in some sense of being active, but it isn't alive.A sperm cannot make another sperm.  (Can eggs ever make other eggs?  I don't know.  I know that they don't usually, but I don't know if some weird mutant eggs do occasionally.)  If a thing isn't the type of thing that can make another of its type, then it is not supposed to be considered a form of life.A sperm cell might be considered to have a form of metabolism- I'm not sure.  I know that sperm are affected by outside chemicals which can cause them to speed up.  I don't know how that works or what the process is called.  An egg doesn't have a metabolism (as far as I know).  Having a metabolism is a necessary condition for life. The cases that we found especially interesting when we discussed this topic were seeds and viruses.  Seeds' dormancy made it hard to decide if they stopped being alive for a time or not.  Frozen cells which can be revived have the same problem.  This can affect the debate over the ethics of embryonic stem cell research.  If their being frozen means that they are not alive (even if they can potentially be brought back to life), then can they be killed?Viruses are interesting too, because they don't grow, they lack a metabolism, and they can't reproduce themselves.  New viruses can only be made if they inject their DNA (or I guess RNA) into a living non-virus.  (Later I learned that prions raise the same issues.  I'd actually never heard of them until I was reading about BSE.)  Plasmids are something I learned about because of this discussion.  It seems to me that whatever category you put viruses, plasmids, and prions into is probably the category you should use for gametes."
2,"Aside: ""Now I could be belligerent and mention that when a human begins to burn resources on reproductive structures that is really the beginning - the point where a human starts preparing the next generation. This illustrates the nature of a cycle, there is always something before.""I'm a bit unclear about what that means.  Does 'burning resources' mean using energy?  What do you mean when you say 'reproductive structure'?  Are you talking about puberty or the development of genitals in utero?""This discussion of beginnings simply does not help with the broader question of   abortion  .""I agree to an extent.  The abortion question is about ascribing rights.  What sort of rights do women have over their reproduction?  How extensive can these rights be before we reach the point of absurdity?  (Unless you're [famous and controversial bioeticist] Peter Singer, you'd have to admit that it would be absurd to try to justify an elective abortion once ex utero viability has been attained.)  What sort of rights do humans have prior to birth?  How extensive can these rights be when they conflict with the wishes of the mother?The questions are philosophical, not scientific.  The reason that I think it is significant to establish that science does establish that human life begins at conception is that it shows people that the issue is not one that can be resolved through science.  If you accept that there is a human life involved other than that of the mother, then you accept that you are dealing with how to ascribe rights.  If you reject that there is another human life, then you can reject as absurd the notion that you would be giving rights to a such a thing- they compare it to giving rights to a tumor.  Some (but not all) pro-choicers use this strategy.  ""The ideologues on both sides of the abortion issue want an answer that leads to a legal result. They both want to create the binary situation that I argue against - the worthless/important dichotomy as you aptly describe it.""Hmmm.  Perhaps.  I'm not sure if I agree with that.  Most pro-choicers allow that a certain level of development entails restricting abortion.  Roe has different criteria for the trimesters.  The current law can be interpreted as taking a 'spectrum' approach rather than a binary approach.  The problem is that the law has to be reasonably simple, and so rather than a continuous gradual change, you end up with 'quantum leaps' from one trimester to the next.As a pro-lifer, I am willing to admit that I do have a worthless/important approach as regards gametes versus zygotes.  I don't think that that is philosophically problematic.  I believe that there is a dichotomy of human/non-human and that being pro-life is an outgrowth of that for me.  I do have a spectrum approach if you expand your parameters far enough.  Some non-humans (non-mammals) have (in my view) no rights.  Most mammals have a right to humane treatment.  Some mammals (great apes and some cetaceans) have rights even beyond that.  All humans have a right not to be injured or executed (especially without due process) but nothing more than that.  Only as you mature to you accrue additional rights. As far as value (as opposed to right attribution) is concerned, that would come up in 'life boat' dilemmas.  If only X people can survive and there are X + N people, then how do you decide who lives and who dies?  Relative worth of human life (in my view) is only appropriate to discuss in such situations, but they are rare.  That's also the reason that I have no problem with exceptions for the life of the mother.""In the absence of people trying to make this dichotomy you and I would never have had this discussion. The minor distinctions between being a sperm with the potential to be human and simply being a live human would be an esoteric subject.""I like esoteric subjects.  I'd probably have been interested in this topic anyway No one is battling over the status of viruses, and I've had discussions about that just for fun.My tastes aren't typical.  :)"
1,"Many interesting thoughts. Do you mean really an atheist, or pretty sure. Absolutely certain atheism seems like another religious belief to me.The definition of what is alive is fun. I threw my hands up a while ago and have just decided that anything that has both the potential to use environmental energy to combat entropy and has evolved counts as alive. I throw out the consideration of the potential for future reproduction. If it evolved to get where it is, then that is good enough for me. Viruses encode proteins that combat entropy. So do some plasmids. Prions do not*. Lizard tails and sperm are both definitely alive - until they run out of ATP and die.*Prions are always tough. There are some yeast prions where the normal (non-prion) state of the protein is an enzyme that would qualify as alive. As far as I know, the prion form always loses this quality."
1,"Brad Miner's argument on the one hand approach the issue from a legal/question of   abortion   point of view to avoid scientific or philosophical arguments, but then goes to the scientific/philosophical arguments to avoid legal issues. Essentially, his argument is that we don't know, so for legality's sake we should say it's at conception, except this ignores other legal issues such as a woman's rights. He needs to either deal completely with the legal issues, or actually tackle the philosophical issues. He's trying to have it both ways."
1,"Adoption does not spare a women the pains/risks of childbirth. One of the main reasons that an abortion makes sense is that it spares women of the pains and risks of child-birth. Adoption does not spare women of these pains and risks, and so fails to address a central rationale underlying abortion.  
"
1,"We can all agree that a fertilized egg is alive. But so also is an unfertilized egg or a sperm. They're not dead, and they're not inanimate objects like a stone. Almost every cell in my body is alive. Life began eons ago, and continues uninterrupted from one generation to the next. So we're not talking about the beginning of life, but the beginning of a particular living individual.Genetically, we could say that a new individual begins when a new combination of genes emerges. This happens whenever an egg or a sperm is formed, and it happens again when an egg combines with a sperm. The latter combination usually lasts longer than the former, but does that make it the only beginning of an individual?And when a fertilized egg divides into two identical twins with no change in genetic profile, are they both still the same individual as was the original cell? If not -- if identical twins are different individuals, then unique genetics must not be the definition of a unique individual. So what is the significance of the fertilization of an egg? Maybe a fertilzed egg is just a potential human being, or dog, or whatever, in the same way that a sperm or unfertilized egg is. Maybe it's the development of a functioning, thinking brain with a unique mind that constitutes the beginning of an individual. That seems to make sense.The religious, of course, substitute the word ""soul"" for ""mind,"" and they speculate blindly about when the soul is assigned to the body, having absolutely no information on the subject. Interestingly, as well, I believe they tend to conceive of the soul as much more mature than the rudimentary single-cell body it supposedly inhabits, capable from the beginning of self-awareness and thought and probably a love of God. That's why killing a brainless single cell is repulsive to them. It really is just a religious issue."
1,"Using Christianity as the answer, let's look at the Bible:Genesis 2:7: ""And the LORD God formed man of the dust of the ground, and breathed into his nostrils the breath of life; and man became a living soul.""Genesis 6:17: ""And, behold, I, even I, do bring a flood of waters upon the earth, to destroy all flesh, wherein is the breath of life, from under heaven; and every thing that is in the earth shall die.""Genesis 7:22: ""All in whose nostrils was the breath of life, of all that was in the dry land, died.""Job 33:4:""The spirit of God hath made me, and the breath of the Almighty hath given me life.""Psalm 33:6: ""By the word of the LORD were the heavens made, their starry host by the breath of his mouth.""Psalm 150:6: ""Let everything that has breath praise the LORD. Praise the LORD.""Genesis 25:8: ""Then Abraham breathed his last and died . . .""These are only a few examples of this symbolism.Against all this, the proponents of conception as the divider will trot out Jeremiah 1:5: ""Before I formed you in the womb I knew you, before you were born I set you apart; I appointed you as a prophet to the nations.""The biblical concept is human being becomes alive when the soul enters the body upon birth and the taking of the first breath.  This Christian belief was the basis for the English common   law   of inheritance, for example, noted by the SCOTUS in Roe v. Wade.Biblical references to death refer to ""breathing his last.""  Now   add   the symbolic essence of the Sacrament of Baptism. Not the pouring of   water   version symbolizing cleansing the soul of Original Sin, but the original (and still common) form by immersion.Immersion of the individual in water symbolizes a return to the womb, and when brought back up, there isa rebirth in Christ Jesus, symbolized by the taking of a new ""first breath.""Christian teaching in the 13th Century approved of   abortion   until ""quickening"" or a more formalistic (and different) number of weeks of gestation for male and female fetuses.  This can be found in papal writings as well as in St. Thomas Aquinas' Summa Theologiae.Current Catholic teaching sets conception as the start. It's clear to me that such a standard should only be imposed on those who believe in such a faith formulation in opposition to the Bible-based truth spanning the human life from first breath to last breath.Creating a   legal   standard based on beginning human life at conception would be to define the end of human life as the termination of the process of decay.  we could expect:a. funeral rites where there is a spontaneous abortion or even an unusually heavy flow after being late with their mensesb. changes in the laws of descent and distributionc. a de-emphasis on ""birthday"" celebrations and a new emphasis on celebrating approximate ""conception day"" anniversaries(with my four   children  , I know an exact date my daughter was conceived, or at least the exact time of the romantic interlude - actual conception could have been a day or even two later.  With the other three, all I can do is count back a couple of weeks or so from ""missing."")d. a reformulation of the sacrament of baptism to perhaps eliminate immersion in favor of the ""cleansing the soul"" motif engendered by pouring watere. all sorts of issues in automobile negligence and other tort lawsuits.It's one thing to respect the process of construction - and quite another to call the structure a house from the time the plans are drawn by the architect and the building permit is issued.  Of course, people don't tend to build houses by accident, while   pregnancy   is often enough an unintended consequence.Human life in the abstract is a continuum - the egg that provided half my genetic blueprint was formed in my   mother  's mother's womb some time in 1927 or 1928, while the sperm that contained the other half was generated some time in the week or two before my conception in the early 1950's. And there was a point in those early 1950's when the eggs that would ultimately ""become"" my four children were formed, while the sperm that prvided the other half of their   nuclear   genetic inheritance were formed in the span from 1980 to the very early 1990's.In one regard, human life is a continuum without a real ending or beginning, and in another, the span of the life of a human being is between first and last breath.I believe in respecting life, even that of pre-born   babies   who are not yet legally human beings.  But I cannot in good conscience impose my own belief on someone else who does not believe the same way."
2,"I agree, when sperm and egg come together there is nothing else needed to determine whether it will grow to be a human or not. The DNA is set for that person forever. The only thing left is growth. Just as a baby from one month to one year living in his natural environment will grow, so does a baby from conception to nine months grow in his natural environment, the womb.Question: Why is it considered a double murder in our law when a woman pregnant with child is killed?"
1,"""when sperm and egg come together there is nothing else needed to determine whether it will grow to be a human or not""Are you sure you're not forgetting something? I think you'll find that the result of mixing those two in a dish will result in a smelly mess, and not a human.And if you're taking the presence of a uterus and functioning placenta, blood supply protective host immune system and the rest for granted, then why bother with niceties like mixing the sperm and ovum? Why not say that the mere presence of sperm and ovum is enough for the die to be cast?"
1,"This is going to be a deeply deranged argument, because the terms in which it is couched are badly flawed.What do you mean: 'life'?On purely biochemical grounds, sperm and ovae are 'alive'. So the embryo will obviously be 'alive' as well. But to extrapolate from this to the conclusion that an embryo represents 'human life' and thus should be afforded full human rights is ludicrous weaselling and sophistry.What distinguishes my appendix from an embryo? They have the same chromosomes - does my appendix deserve 'rights'? Should I be allowed to have it surgically removed?Some will object that an embryo has potential to become a human. But so does a sperm or ovum - to which we accord no rights of humanity whatsoever - given circumstances that are only slightly more complex.And so, in fact, does a cell from my appendix, if certain procedures are followed and the nucleus is extracted and inserted into an oocyte. If potential is the yardstick, any living human tissue has it, and I can see no sensible line of argument for special treatment of fertilised ovae that would not also apply to other tissue, or to gametes.Happily, apart from some religious ideologues and dogmatists, few people try to maintain such nonsense. Most tend to adopt an uneasy acceptance that somewhere along the process of gestation, a lump of tissue acquires sufficient similarity to a true human to acquire the rights that a human has. Unfortunately, this feeling is heavily influenced by the instinctive protective drive that all animals have for their young, and biased by it.Interestingly, the Old Testament has a much more pragmatic approach, in which children are not considered people for practical purposes until they have reached the age of around one month."
