1,"So a child (remember that nowadays 10-year-old´s can become pregnant) who has been raped by her father should be forced to beg him for an   abortion  ???In Brazil it was the stepfather (who was a   legal   guardian until he was put into jail) and she girl 9.Is this the ""Pursuit of Happiness"" in the US???Note: I chose my name from personal experience, at that age I found out that ""THE HORRIBLE"" would soon force me to have   children   myself, and never be able to leave the abuse family; and have fought off ANY touch since then - and it was absolutely exhausting."
2,"Senator Obama has promised to sign the Freedom of Choice Act if elected President.  With the majorities the Democrats will have in both houses of Congress, that legislation will certainly arrive on President Obama's desk and he will certainly sign it.With the stroke of his pen, abortions will be paid for, here and abroad, with federal funds, and the reasonable parental notification and consent laws that have widespread support will be swept away.So, in fact, this election will be a referendum on FOCA."
1,"Everyone knows that God has given us something we call free will. You are able to do whatever you please, but of course there are consquences. If you cannot make your own choice on who to vote for then there no longer is free will. There is only one ruler we must answer to and VOTE for and that is the Jesus himself. We have always be able to make our own decisions but your conscience tells you what is right and wrong. So in election time there will be no right man in God's eyes because he is the only one. Your choice i your choice. The only one you have to answer to his him. Voting for anyone who believes in the death penalty is also wrong if you want to put it into cases as this. Like my pastor says God doesn't believe in any type of death. From the WOMB to the TOMB"
1,"WE are forced to pay for born-unwanted´s,WE are forced to pay for slow and painful dying still,so - why should the faithheads NOT be treated equally and pay for what THEY do not want (or never need, if male!!!)?But am I talking to the enthusiasts of the penal   law   here?If there is any ""common ground"" on personal matters, it can only be NO penal law, everyBODY decides over his or her OWN body, and   health insurance   pays for a limited amount of the most costly decisions (like IVF), but all of the not-so-expensives seen in the long run."
1,"A woman has the sole right to decide to seek an abortion. A woman carries a child during pregnancy and undergoes child-birth. No-one else carries the child for her; it will be her responsibility alone, and thus she should have the sole right to decide. These are important events in a woman’s life, and if she does not want to go through the full nine months and subsequent birth, then she should have the right to choose not to do so. There are few – if any – other cases where something with such profound consequences is forced upon a human being against her/his will. 
"
2,"There is nothing ""unlikely"" about the passage of the Freedom of Choice Act if Senator Obama is elected President.  That Act will reverse the Hyde Amendment and will strike down parental consent/notification laws throughout the country.The Congress is going to be controlled by Democrats, who will certainly pass the Act, and Senator Obama has promised pro-abortion groups that the first thing he will do as President is sign the Act into law."
2,"The statment released yesterday by the United States Conference of Catholic Bishops directly refutes this argument by Catholic Democrats.  Catholics who want to see what the Bishops have to say on this issue should go to usccb.org for the statement.It should be noted that the statement was issued under the names of Cardinal Rigali, Chairman of the Committee on Pro-Life Activities, and Bishop Murphy, Chairman on the Committee on Domestic Justice and Human Development.  Catholics must fight for Social Justice and fight against abortion.  As set forth in the first paragraph of the statement, ""Unfortunately, there seem to be efforts and voter education materials designed to persuade Catholics that they need choose only one approach: either opposing evil or doing good.  This is not an authentic Catholic approach."""
1,"Let me first just thank for a highly repetitive post, with pretty much 1 reason you couldn't vote for Obama. Who then, can you vote for?  None of these men - and none of the women - hold Christian values.  Oh there's lip service... but then, most people who claim to be Christian do little but go to church.  So voting based on your religious views is sillier than believing in the tooth fairy.  Let me just point out to you that Obama's plans as a whole are decidedly more in line with the ideals of Christ.   And indeed, if the whole of the Congress voted according to their Christianity which they claim to express there would be no Iraq war, nothing in Afghanistan, universal health care, free food for the homeless, shelters, and so on and so forth.  Things McCain is dead set against - as are most Republicans.  Yet giving to those who have nothing, and shunning the materialistic impulses are Christian values. Speaking of Christian values, is this why the Vatican is so rich?  Because it's money that gets you into heaven?  Or the way you vote?Or maybe it's your own individual actions....  Because the only reason you can come up as to not vote for Obama as a opposed to McCain was   abortion  .  Because that's the one issue that would help more people.  Good job.  Obama won... and this probably upset you because of the ONE reason you could think of.  "
1,"I wrote in for Ron Paul, so don't tell Me what's crappy about Obama because I don't like him.  I like him like this much better than I like McCain.  As for the current president - well. Bleh.I was just pointing out that Jesus Christ would be laughed at.  If he came down out of the clouds and sat at the right hand of Nancy Pelosi and espoused the same views... the very same ""Christians"" sitting in congress would laugh at him.  If he wasn't shot first.    Because Christ would tell them to feed the hungry, give their coats to those who were cold, let strangers sleep in their homes - or at least their garages (?) - and to give away whatever they didn't need.   These policies are more closely matched by Obama.  So if you're going to use your ""Christian"" (as if that means anything) views to vote, why would you vote for someone whose policies are better for the richest people and crappiest for everyone else? Makes absolutely  no sense.   Yet time and time again, people will vote not for policies that more closely resemble their beliefs, but for the candidate who claims the loudest and fiercest that yes, they too, are Christian.   The ""Christain"" values that politicians profess are meaningless because you're exactly right - we can't run the world on them. The hypocrites who run things can pick and choose which so-called sins (so called because they're only sins if you're a religious type), but that doesn't mean a jellified thing.   A ""Christian"" would do what they were told to do... and that is the exact opposite of what happened the past.  Well.  FOREVER history of politics and politicking.  As for the Vatican having more money than Davy Crockett (never did get that line from Forrest Gump), that wasn't a low blow.How much harder is it for the rich to get into heaven? Doesn't their very own Christ supposedly say that?  So how exactly is it a low blow to point out the hypocrisy of a religion that professes to be the conduit between God and men? They have a frikken POPE!   A Pope that wears gold rings and chains and carries a scepter and everything.   They should be like Schindler... How many people could be clothed, fed, sheltered by the worth of that ring alone? The gold? The money?   That's why it's hypocritical.  That's hardly a low blow. It's the truth.   Crappy? Maybe if you're Catholic.   But it's entirely the truth, so targeting the wealth of a religion that supposed to shun it isn't hitting below the sacremental belt at all.Anywho.  "
2,"...no, they can not be Pro-Choice.The Catholic Church is very strict. According to its own self-proclaimed, self-appointed duty, it is the conduit between Man and God. It's rules - it's laws - are God's rules - God's laws. If you're truly Catholic you accept everything the Vatican says without question. It is God's word.If you call yourself Catholic and believe you can be Pro-Choice, you're delusional. I consider Catholics who believe this to have ""selective faith."" They follow the rules of the Vatican that are convenient for them, using the principles of Christianity as fire insurance. ""As long as I ask for forgiveness, I will be saved."""
1,thats not so any more
1,faithful catholic are there still any?
1,A study was done on the   voting   record of Catholics in Congress. The   pro-life   congressmen voted with the   church   against   abortion   but on nothing else. The   pro-choice   congressmen voted with the church on everything except on opposition to abortion. Now who is the good Catholic?
2,"then one needs to consider all those questions before you lay down and have unprotected sex. sexual awareness is becoming more and more prominent. on the other hand, i think that most would agree that there are extenuating circumstances. ie: rape, or if the birth itself would place the mother in danger. but, it should not be a cop out for a night of bad decisions. i also think the fathers should be given more of a choice when it comes to   abortion  . not all father's are dead beats, and some would love the opportunity. in many cases this is taken from them. it is just as emotionally traumatizing for some men. where's the fairness in that. woman don't want us telling them what they can and can't do with there body's. well, start considering the fathers a little."
1,"Upon hearing that a sexual partner of yours became pregnant and was considering   abortion  , carry the child yourself if medically possible?"
1," Abortion is the woman's choice, not the father's The Father should be told that the woman is having an abortion but until he carries and gives birth to his own baby then it is not his choice to tell the woman that she has to keep and give a painful birth to this fetus.
"
1,"A woman has the right to decide what happens inside her body.  In the end making it illegal will only punish poor woman, as wealthy woman will always have the option of having an abortion. "
1,"A human being has no moral obligation to another person to allow that person the use of what is theirs, even if that second person needs it to survive. If you disagree, I've got a really excellent proposition for you."
2,"Hi Cameron.You are using a pretty sophisticated philosophical argument first made years ago in print, by a female philosopher. A friend of mine (a University Professor of Philosophy) wrote an entire book on this and a couple of other important,   pro-choice   of   abortion  , philosophical arguments.You seem somewhat sophisticated, using the argument that you do.  Are you also a Professor of Philosophy, or an interested philosophy student, or maybe just a very bright and thoughtful individual?  Perhaps you might actually know my friend: Professor Steve Schwartz.  Cameron?  I'm not sure that I spelled his first name correctly (maybe it's ""Stephen"").  Google his name and perhaps the title of his book will also appear.I'm sorry.  I'm a little old, now; and I can't remember the title of his book just now.  It was more than a decade ago.Let me know if you can/can't find the book.  I'll try to get you plugged into it.raymond"
1,"If not, I've got nothing. You're going to have to give me a link.And I'm a poli sci student."
2,"Hi, Cameron:I googled him for page after page, and came up empty.  He's retired from URI and is working at another educational institution.I have his phone number.  I'll see what I can do."
1,So   abortion   is okay in areas where more people like it than don't? 
1,"Why do you think that slavery became a federal issue? Would you have said that the southern states were fine to continue it as long as the northern states were allowed to abolish it, and vice versa? Abortion is a federal issue, and I know that because it was ruled on by a federal court. It's a constitutional issue. States cannot simply refuse to observe the wills of the Supreme Court or the   constitution   because most of their constituents dislike them."
2,"Quote from previous commenters: ""...in 2002 alone there were 357 maternal deaths in the USA."" It is true that indeed giving birth is NOT without its risks.But successful abortion carries a 100% rate of risk of death to the child. And in contrast to the unfortunate 357 maternal deaths we see an unfortunate rate of almost 1.3 MILLION infant deaths in 2002 to abortion (    http://www.nrlc.org/ABORTION/facts/abortionstats.html    ).I suspect it is one's ego that is willing to value one life more than another... or one life more than 3,613 others.In response to ""A woman has a right over what happens inside her body,"" actually I believe what the previous commenter was trying to say was ""A woman has the right over her own body."" But science tells us that the child inside is not her body, but a completely different body and person. Common sense concludes that nobody has the right to control the life or death of another person regardless of their location, age or status (born or not)."
1,"I can only assume by your moniker that you are a male and consequently will never experiance facing an unwanted pregnancy.  Infants are not ""being killed"" because an embryo is not an infant.  Until that ""child"" can function and breath on it's own it's still considered part of the woman's body.  A woman does not give up her human o legal rights simply because she conceives.  Like I've said, unless the woman involved is your girlfriend, wife, mother, sister, ect. you have no right to tell her what to do with her body.  It's of no financial burden to you if she chooses   abortion  .  It's of no concern to you if she chooses abortion.  The woman is a stranger to you.  You have no knowledge of her financial or emotional circumstances.  It's none of your business unless you plan on supporting the child for the next 18 years of it's life."
2,"I've been pregnant 5 times, if that means that I am uniquely more qualified than a man to make a decision about something that relates to women.Abortion kills a human offspring at the stage of human development called either embryo or fetus.  That doesn't make it non-human.  Infant, child, adolescent, and adult are names for other stages of human development.An embryo has, from the very moment of conception, it's own unique DNA.  That is a scientific fact.  It is not a part of a woman's body but a unique being that happens to be developing in the place where it was designed (by God or nature, your choice) to develop until the time it is ready for birth.It absolutely does affect everyone if   abortion   is legal.  There are many consequences to society, whether financial (when taxpayer funds are used to fund it, or in dealing with the medical consequences that often follow) or not (as in the higher rate of child abuse that we have in the time that abortion has been legal).I support groups that help women when they are in crisis pregnancy situations.  If a woman has a financial or emotional circumstance that may cause her to think that abortion is her only choice (or if she is pushed into an abortion by a boyfriend, husband, parent, or someone else), we as a society should stand up and let her know that there are ways that we can help her besides telling her that killing her child is the only option.  The way to help a woman with a crisis pregnancy is to help her solve the crisis.Abortion is a betrayal of women - even early feminists like Susan B. Anthony believed that.  Those who didn't are women like Margaret Sanger, who was a proponent of eugenics and a racist who supported Hitler."
1,"The mother's life is more valuable than the fetus. What makes the mothers life more important is that she is a full-grown adult and has the ability to make more children. 
"
1,"You better study your history dear child.  Hitler was all for eugenics and forcing abortions on those he didn't consider racially pure but if a German woman wanted an   abortion   whoa Nelly!  It was illegal to have an abortion for them and anyone who performed an abortion on their racially pure German women were executed for their ""crime"".  Let's just agree to disagree.  I believe that the woman is here and now.  Her health, her body, her life is paramount.  An embryo is an embryo.  No one forced you to have an abortion against your will but yet you feel you are so morally superior that you have the right to make decisions regarding other women.  99.9% of them are total strangers to you.  If you don't believe in abortion then don't have one.  End of argument.  I support your right to have as many pregnancies as your body can tolerate and if by chance it may kill you in the process, then I support your right to commit suicide in order to bring the fruit of your conception to delivery.  It's your business and your life just stay the hell out of other women's privacy.  We have thousands of children languishing in foster care, hundreds of thousands without homes living on the street or in homeless shelters because their parents don't have jobs (or don't make enough to pay rent), millions more without healthcare because their parents make too much money to qualify for state assistance but not enough to purchase health insurance.  Millions of children in this country go to bed every night hungry.  Why aren't you working your ass off to see that these problems are addressed FIRST before demanding that all women must be forced to live by YOUR moral code???  Many women wouldn't seek to have an abortion if they made a decent wage and had affordable health care so why don't you put your efforts into passing legislation to increase the minimum wage and make national healthcare a reality.  I bet you'd be surprised at how much that would reduce the numbers of abortions.  Oh, and since your side tends to be anti-birth control I'd suggest you also make sure that women of childbearing ability have all the access to that.  We don't need more pharmacists telling women that they can't take birth control pills because it offends their moral standards.  "
1,"Of course I've ""heard"" of adoption.  Golly, did I fall off the turnip truck today?  Your arguments are based on emotion, my arguments are based on fact and experience.  No one should force another to have a medical procedure against their will nor should you have the 'right' to impose your religious views on other women.  You have no right to interfere in another woman's right to privacy.  Banning   abortion   won't stop women from having an abortion it forces them to seek out an expensive and unsafe medical procedure that has a far greater chance of complications and death than having a safe procedure done by a qualified doctor.  I took care of women who aborted themselves and it wasn't pretty.  I found it rather disgusting to have a police officer come to her bedside when they should have been chasing real criminals.  We have nearly a half a million children in foster care and almost half of those need homes.  They may not be cute babies but they are no less deserving.  As I have said so many, many times before, if you don't believe in abortion then don't have one.  Work to make it a better world where few children are in foster care.  Where they can be born wanted, have access to shelter, food, medical care,  education and their mothers/parents can make a living wage so they don't have to worry if an unwanted pregnancy happens.  You are the same kind of people who want to ban birth control.  I find it outrages that people who work in pharmacies refuse to fill women's prescriptions for birth control pills because they 'don't believe' the have the right to prevent pregnancies.  Why people feel they must force their brand of religious insanity down other women's throats I'll never know.  There will always be cases where a woman's health requires having an abortion.  Her life and health will ALWAYS take precedence over a hunk of cells as far as I'm concerned.  There's no 'there' there when it comes to an embryo but a woman is very much 'here and now'.  Besides tbcass, you still haven't addressed my comments regarding the fact that unless the woman is a member of your family you still have no right to interfere in her privacy. Again, it's none of your business so get on with YOUR life and let others live there's.  You can't keep insisting that all pregnancies must be brought to birth and then just dump them out in the cold to fend for themselves..really, try and think this through."
1,"""Guess what? I'm an Atheist! I'm against   abortion   because I believe that it's wrong to take a human life period. I'm also against the death penalty. As a person with a degree in Biology I realize that Human life begins at conception.""In other words, one human being can coerce another human being to provide services for them, regardless of whether the other human being (providing the services) consented to this contract of sorts?"
2,This is definitely true. Women and teenage girls should be educated about this and they should have used protection! 
2,"Why do you think that   abortion   should be Legal? It's like killing a human. Why not give them the chance to live! Women make choices everyday! They made the choice to get pregnant and here are the consequences. They should learn from their mistakes and   adoption   is an option!!! Because an unwanted child can lead to an abused child, therefore they can choose adoption. Going to another topic...Gay marriage should be   legal  ! There are couples out there that really want to adopt a child in need but they can't. If you need the abortion because of rape or incest, medical complications should be allowed for them to get the abortion. Don't make the wrong choice if you can't handle the consequences!! Most abortions come from teenagers and they need to learn that   abstinence   is the way to go. Too much to say about this but i'll end it here."
1,"You're confusing that statement to mean that fetus is part of her body.  That's not what we mean. We mean that the woman has the right to her womb (which is part of her body).  As you said ""Common sense concludes that nobody has the right to control the life or death of another person regardless of their location, age, or status (born or not).""  But if you really meant that, your own common sense would conclude that the fetus does not have the right to control the life of another person.   Since the fetus is inside the womb, the woman must live her life for that fetus.  She gives up the right to control her life because of the location of the fetus.  She must, even at risk to herself (and risk is not merely death, but also of stroke, hemmorrage, etc.), carry that unborn ""child"".  It IS unfortunate, but it the design of nature... ""God"", whatever you want to say... that the fetus is carried by the woman instead of being laid as an egg.  Wouldn't that be nice? Then the egg could be abandoned if she wanted and anyone having a problem with that could take up the responsibility of caring for it until it hatched (was born).  The problem with saying that a woman has the rights to her womb ignores the potential child. I think it perfectly ridiculous to say that a woman can have an   abortion   is the fetus is mature enough to survive outside the womb.  In fact, if it even close to being able to do so, the woman should not be allowed an abortion, but should have a c-section instead.  The whole thing is not wanting to be pregnant... for whatever reason.  So by having a different procedure done (and it really is about the same), the woman retains control over her body and the problem is solved of 100% death to the babe.  If the baby dies, it is only because it was not able to survive.  Note, I am not saying that the medical community must ignore it, rather that the woman is merely evicting something she doesn't want from her womb.  She has absolved herself of responsibility from whatever happens to that fetus.  Anyway.  The ego that says the life of one is more valuable probably depends on where you're standing.  Do you value the life of your child over the lives of 3,613 strangers?  Do you value your life above that of 3,613 strangers?  Of course you do.  We all place greater value upon those we love and care about.    Why is it unnatural to place greater value upon the rights of your womb than the rights of a stranger to use your womb as it wishes?   The woman who chooses an abortion is merely choosing the right to keep her womb empty.  The woman who chooses to remain pregnant is voluntarily giving up her rights, and her life, for the fetus.  One is not a bad choice, and one an evil choice... we say we have individual rights, but pregnancy blurs the lines because one individual is actually  inside  the other.   But the bottom line in this is that the woman utimately must be able to have control over her womb.   Being able to have an abortion legally protects not only that right, but also the health and safety of the woman to do what is already in her rights to do. "
2,"your exact words ""But successful   abortion   carries a 100% rate of risk of death to the child""no duh, that's the whole point of abortion, is to KILL THE BABY. well actually that's MURDER"
