1," A fetus cannot have a right to a woman's body to sustain its life No individual has rights over another individual. Therefore, a fetus cannot be said to have an inviolable right to a woman's body and sustenance from that body. A woman can, therefore, decide to deprive the fetus of the usage of her body (abortion). 
"
1," A fetus is no more a human than an acorn is a tree Judith Jarvis Thomson. ""A Defense of Abortion"". Philosophy &amp; Public Affairs, Vol. 1, no. 1 (Fall 1971). - ""Most opposition to abortion relies on the premise that the fetus is a human being, a person, from the moment of conception. The premise is argued for, but, as I think, not well. Take, for example, the most common argument. We are asked to notice that the development of a human being from conception through birth into childhood is continuous; then it is said that to draw a line, to choose a point in this development and say ""before this point the thing is not a person, after this point it is a person"" is to make an arbitrary choice, a choice for which in the nature of things no good reason can be given. It is concluded that the fetus is or anyway that we had better say it is, a person from the moment of conception. But this conclusion does not follow. Similar things might be said about the development of an acorn into an oak trees, and it does not follow that acorns are oak trees, or that we had better say they are...A newly fertilized ovum, a newly implanted clump of cells, is no more a person than an acorn is an oak tree."" 
"
2,"Women can only be ""pregnant"" with a ""child"" not merely a ""fetus"" This is similar to the above argument. The point is that pregnancy can only be called pregnancy and that you can only be pregnant with a ""child"". Nobody would ever say, ""I'm pregnant with a fetus"". Therefore, fetuses should be considered ""unborn children"" with correlating rights.
"
1,"Viability is a good cut-off for when abortion is appropriate or not. Anthony Kennedy, U.S. Supreme Court, speaking for the Court in Planned Parenthood v. Casey, 505 U.S. 833 (1992) (joint opinion coauthored with Justices Souter and O’Connor) - ""At the heart of liberty is the right to define one's own concept of existence, of meaning, of the universe, and of the mystery of human life....[P]eople have organized intimate relationships and made choices that define their views of themselves and their places in society, in reliance on the availability of abortion in the event that contraception should fail…. We conclude the line should be drawn at viability, so that, before that time, the woman has a right to choose to terminate her pregnancy....[T]here is no line other than viability which is more workable. To be sure, as we have said, there may be some medical developments that affect the precise point of viability, but this is an imprecision within tolerable limits....A husband has no enforceable right to require a wife to advise him before she exercises her personal choices.""[29]
"
2,Science says it's not a baby.I beg to differ.Science said it is a baby.The baby has its own DNA and at nine weeks he has a heartbeat.A baby at twelve weeks is very complex.Every organ is present.This link lists the development of a baby in the womb.PLEASE READ THIS!!!!!!!
1,Why counter a wrong with a equally wrong action?The evil of abortion is equal to the evil of rape.Only 1% of all abortions are performed because of rape or incest. (Guttmacher Institute)
2,"I find the fact that there are instances where women think that it is right to abort the birth of a child is incredibly outrageous! To think that people would rather cut of life in its entirety than to take wiser options, such as setting their child up for an adoption, or even personally entrusting the baby to someone close to them. If I could 'personally' define the word 'abortion,' then it would be as follows:'ABORTION: The term refers to the irrational decision to KILL the child before it has been birthed from the womb'I am not going to sugar-coat abortions, because it's true, they are nothing short of murder! 'The children are killed before they can even process the thought' is one term that I have seen a few times in this debate (of course they have been worded differently, but again, I am not here to sugar-coat this sort of thing), and I can say that the mother/father has STOLEN the right and privilege of thought from these children by killing them. They have also denied them of love, care, protection and most of all, they have denied them of a life.As I have stated previously, I cannot even begin to understand why so many pregnant women do not consider putting the child up for an adoption rather than simply cutting the child off completely! Surely the majority of you all would agree with me that a child has its rights even if it cannot understand them! But the second that an abortion begins, you have stripped that child of it's rights, and there is no way that you can ever make amends. And no, I am not trying to send anyone on a guilt-trip, but I would be glad to know that some of you have come to realize what exactly an abortion does, and not just to think of the process as ""stabbing someone in the vagina."""
2,"Most abortions occur at 10 weeks, can somebody please look at these pictures and please tell me what that is if it's not human. And if you dare go watch the video silent scream and please tell me what is going on there, because they sure aren't removing a clump of cells. If your are for abortion please tell me what that is they are sucking out into the trash.I don't think most people know what an abortion is, nor have they seen one. If you are for abortion at least inform yourself and watch the video silent screamand make an educated call about abortion"
1,"You're so closed minded it's ridiculous.In fact, quite a few people have experienced abortion first hand, and it's never an easy decision, but sometimes it is the right one.It doesn't matter what the thing looks like. Science tells us that thing is not yet a sentient being, therefore it is not killing a sentient being. Cute pictures does not = sound scientific reasoning.You don't like abortion. Fine, don't have one, but that you choose not to believe the fact that at ten weeks that little thing has 0 sense of self, does not constitute any type of proof that abortion should be banned for those who choose to undergo it before that thing is sentient.No one is for abortion once the child is self-aware. A self-aware human should not be aborted.That is not a self-aware human, no matter how cute. And that said, the vast vast majority of abortions take place before the first couple weeks.And that said, most science says there is not even a hint of possible self-awareness until around 26 weeks!"
2,"I guess you were not man enough to match the video Silent Scream because that video clearly show a fetus doing what you say it can't; showing signs of awareness.I also I didn't say""  few people have experienced abortion first hand"". What I said is that few really know what it is.About being ""closed minded ""it doesn't matter what the thing looks like.""If it looks human and genetically it's human; it probably is human.The question still remains unanswered: What kind of being is it? Your attempt to redefine the question hasn't changed the question, nor does it answer it. And a question not properly answered doesn't go away. That's why abortion is still a hot topic 35yrs after Roe vs Wade. There are a lot of people for whom something seems dreadfully wrong and for those of you who support abortion to dismiss us with some fancy mental gymnastics is simply inadequate. So please, answer the question.You also lose credibility with statements like these""the vast vast majority of abortions take place before the first couple weeks."" How do you abort something you don't know you have? In most cases it's a missed period that tips the woman off and that takes time. Facts are annoying things when they contradict you and you can't make them go away by changing them. Do your research first before you make assertions like this, Because for those of us who have. you lose credibility. But I think you make my point that most people don't know much about abortion. But tell me iamdavidh, were you ever an unborn baby? Because if you were. you have to acknowledge that an abortion would have killed you, not something else but you. And that means abortion kills people in the early stages of their life not something else that later becomes them, but them."
1,"Listen, you want to believe it's a living thing based on that video, fine, I'll trust science. If science says it's a sentient being, I'll be against it.In the meantime, don't make these poor girls feel worse they they already do about the whole thing.So you're against it, but obviously a lot of people think that ""silent scream"" is rubbish.You know what, beatles make a noise when you squish them. They're not sentient though, and they actually have more brains than a fetus before the first couple weeks.Meanwhile, these poor girls, half the time they were raped, or their still just kids them self,and you get these nuts calling them nazis and killers and everything else,you know what, they're not killers. I don't know what a fetus is, you don't, but science does, and science says they aren't people yet.It says they're people after the third-trimester,before then, leave these girls alone until you have some scientific proof beyond,""I really really really really feel it's a living person.""And to the last ridiculous paragraph. Had I been aborted I would have never existed, and so no, I would not have been killed. So there. I was a sperm once too, should guys stop ejaculating?"
2,"Science has been wrong in the past. If science were always blindly trusted, we would never progress. It is challenging science that makes us find new and better answers."
2,You are wrong about science saying it is not a human being.SCIENCE SAYS IT IS A HUMAN BEING.SCIENCE SAYS THAT THIS BABY IS VERY DEVELOPED AT TWELVE WEEKS.I thought you might want to know this.
2,You should spend more time thinking about what you say before you type because you are starting to appear irrational.
2,"A line on ""viability"" is arbitrary; from conception humans are always increasingly ""viable"" It is faulty to claim that a fetus can achieve ""viability"", where it becomes an independent creature and worthy of some rights. Humans are always increasing in their independence and ability to survive. In modernity, children cannot survive on their own into their teens.  
"
1,"... science is irrational... and pretending you hear the screams of things that haven't developed vocal cords is perfectly sanegot it, thanks for the heads up :/These downvotes don't impress me either. I realize there is a religious coupe going on on create debate right now. But you'll get bored of being wrong eventually and move along to a site that will reinforce your misguided opinions instead of challenging them. Don't worry about saying good-bye, I hate long good byes and I tear up, you know, the emotion and all..."
2,"You are good at making my point thank you. A question not properly answered never goes away, and equivocating on terms is a poor attempt to cloud the issue.It does appear you are rather uninformed about fetal development. I do hope you would be more open minded and consider the possibility that you might actually be mistaken.I only down vote faulty logic :) and insult is no argument, please deal with ihe issue at hand and actually respond to what is said and not what you think is said."
2,AT NINE WEEKS A BABY HAS A HEART BEATONCE AGAIN I ASK YOU TO READ THIS LINK!!!!
2,"how is stabbing a pregnant dog, the same as abortion. it is completely different. we're not saying u can stab a pregnant person but we're saying that the pregnant person should have the option to abort. not that it is ok to go and stab any person that is pregnant."
1,"Read what I was replying to. I was being facetious.Following the logic of the statement I was replying to, it would wrong to have an abortion ever under any circumstance, but something like say, stabbing a pregnant dog in the vagina, would be just fine... if one were to follow the logic,which it's become quite apparent few posting under this topic are capable of."
1,"we're saying that the pregnant person should have the option to abort.Then why is your argument tagged ""abortion should be banned""?Also funny to note is that (at this time) your post is the top post on this side!?"
1,"No answer to my retort, just a down vote. That helps alot!?"
2,"Yes, this type of stupid hypocracy must be banned!The parents have right to kill themselves but not their growing babies.Many countries face a crisis due to this. If the abortio is not a safe mode executed, then it can affect the parent's health too.Friends, How can you accept the death of an innocent infant who never harmed you?"
2,"In 95% of cases it is the woman's fault for becoming pregnant, especially in teen cases."
2,Abortion is stupid. All thes chicks that have abortions are stupid.
1,"A ban on abortion presents practical problems of enforcement: Enforcing an abortion ban would require a quite degrading and inhumane treatment of those women who wished to have their foetus terminated. Moreover, if pregnant women traveled abroad, they would be able to have an abortion in a country where it was legal. Either the state takes the draconian measure of restricting freedom of movement, or it must admit that its law is unworkable in practice and abolish it. The ‘third way’ of tacitly accepting foreign terminations would render hypocritical the much-vaunted belief in the sanctity of life. In addition, the demand for abortions will always exist; making abortion illegal, will simply drive it underground and into conditions where the health and safety of the woman might be put at risk.
"
2,"Abortion is dumb, all the woman who have any are STUPID!!!! Abortion could ruin the race of mankind!! Then we would all be dead!!!!!!!!! AAAAAAAAAAAGGGGGGGGGGGGHHHHHHHHHHH!!!I do NOT like the idea of abortion and obama is stupid to give federal funds to abortion!!!!"
2,This is not an argument but supporting evidence of why abortion should be banned. This woman knows first hand what abortion is and what it does. If you are going to argue for abortion you will need to overcome this woman's testimony. But I bet most people will just attack her character falsely.
2,"Hi, I am a eighteen year old senior who was born two and a half months premature, a time when abortion's have been done. My mother and I were both in extream danger of dieing, my parents could have said, take it out and get my wife/myself out of danger then I would not be here today and plenty of children will never have a voice. If a mother or a couple does not want a child there is always the option of putting the child up for adoption, at least it will have a chance at life and a loveing family."
2,Thank you for your testimony. I'm so glad you spoke up and would strongly encourage you to do it more often. Apart from rape your case is the most often used justification for abortion. And as your existence proves it is not proper justification. I know of a woman ( I can't remember her name) but her mother was rapped. I know of her because she is doing public speaking on this issue of abortion.You are a testimony to the fact the abortion snuffs out a human life because it would have taken yours. Thank you again.
2,"Abortion: One Key Issue  By Gregory KouklAbortion involves killing and discarding something that's alive. Whether it's right or not to take the life of any living being depends entirely upon the answer to one question: What kind of being is it? The answer one gives is pivotal, the deciding element that trumps all other considerations.Let me put the issue plainly. If the unborn is not a human person, no justification for abortion is necessary. However, if the unborn is a human person, no justification for abortion is adequate.©1999 Gregory Koukl. Reproduction permitted for non-commercial use only.For more information, contact Stand to Reason at 1438 East 33rd St., Signal Hill, CA 90755(800) 2-REASON (562) 595-7333 www.str.org"
2,Many abortion doctors admit that this baby is a living human being. Many baptize the babies after the abortion is finished.
1,"Well, the question is what makes us a person, and what makes us special above those beings which are okay to kill (most animals, insects plants etc...). I would argue that it's our ability to think and feel at a higher level. An embryo cannot think, feel, see, hear, remember, or do any of the other things that distinguish us as people and therefore must be put into a separate category then a fully formed person.Considering your ignorance on the topic of biology that you demonstrated in the evolution debate, I would not be surprised if you were unaware of this, but if you don't believe me I would be happy to provide evidence (or you could save me the trouble and trust me).The question then becomes: at what point does the unborn embryo/fetus gain the rights of a full grown person? There are two extremes:1) The moment after conception.2) The moment of birth.My problem with number one is that a single celled organism shouldn't have rights that are equal to those of a person, and my problem with number two is that mere physical location (outside rather than inside the womb) shouldn't dictate whether we have rights, so I propose that the embryo/fetus gains rights over time as it develops. How early these rights are given is obviously something that is going to be debated, and, in my own opinion, should be debated because it will be a much more fruitful debate than the current ""all or nothing"" one that is all too common."
2,"The question isn't about person hood, The question is what kind of life is it?By your logic it is OK to kill another human, especially if they are smaller and less developed than you , if they can't think, feel, see, hear, or remember than by all means, kill em. What you have just done is discriminated against a whole class of humans that are inferior to you and deemed them unworthy of life by your arbitrary standard. That sounds just like the logic of the Third Reich to me. And that's exactly how they categorized it; the life unworthy of life.But let me ask you; were you ever an unborn child? If you ever were the unborn child your mother carried, then you have to accept an undeniable truth: killing that child through abortion would have killed you. Not a potential you. Not a possible you. Not a future you. Abortion would have killed you. Aren't you glad your mother didn't view you in the same crass way you view other humans in the early stages of development. You are in essence arguing for a right that could have taken that very right from you. And just for the record, most abortions are performed at about 10 weeks. I've included a link so you can see what those embryos look like at 10 weeks. And please tell me what that is if it isn't human. Also in regards the fetus's (it's a fetus at 10 weeks) ability to think, feel, see, hear and remember watch the video ""Silent Scream"" to get a sense of just what it is you are arguing for. What you'll see is a fetus (just like you once were) recoil in fear has they fight for their life. But I do warn you, the footage is extremely graphic."
1,"If it can't think, feel, see, hear, or remember; can't survive without complete and total dependence on the biology of another being; and doesn't look particularly like people -- what exactly is it that makes this a ""human""?"
2,"Well first off it's pretty obvious what makes it human, genetics.About thinking, feeling,seeing and hearing go watch the video""Silent Scream"" and tell me what that baby is doing."
2,"Difficulties of enforcement should not diminish the principles of the law: Many laws have difficulties pertaining to implementation, but these do not diminish the strength of the principle behind them: people will kill other people, regardless of your legislating against it, but it does not follow that you shouldn’t legislate against it. 
"
1,"I've seen ""Silent Scream"" four times already; I was convent-schooled and thus unsurprisingly I've been shown lots of graphically disgusting abortion pictures. And y'know what? I'm still not remotely persuaded that it is preferable to ruin women's lives or leave them to die in back alleys.DNA? Your sperm has DNA. Your hair and skin cells have DNA. Your saliva has DNA. Are sperm, hair, skin, and spit also human beings in their own rights?About ""thinking, feeling, seeing and hearing"" -- you conceded that an fetus slated for abortion is not capable of doing these things in your post above. ""By your logic . . . if they can't think, feel, see, hear, or remember than by all means, kill em."" So this new argument that ""Silent Scream"" contradicts your earlier premise that the fetus does NOT ""think, feel, see, or hear"" is simply logically inconsistent."
2,"Ok, so it's better to kill 1500 children a day than a handful of women periodicallyDNA proves humanity, that's allUm whoops, you took that out of context. Go back and read what I said. Notice how that quote starts. by your logic it doesn't say by my logic"
1,"But you posited the ""can't think, see, feel, etc."" You supplied that and you endorsed it by posting it. Notice how you did that. Can't get out by saying that your characterization was part of a criticism - it was still  your characterization.A clump of cells in utero is not a ""child."" That's why medical science has words like ""zygote"" and ""blastula"" and ""embryo"" and ""fetus.""If you are asking for my personal opinion on abortion, which you seem to be, it is that abortion is a highly imperfect solution to a very real problem; but that until we have developed and agreed as a society to disseminate a completely 100% effective, safe, and pragmatic method of birth control complete with age-appropriate sex education AND eliminated rape and abuse or coercion of children, then the societal costs of limiting abortion access much further than it already is (and it IS limited; states can regulate it after the first trimester and can ban it completely once the fetus reaches viability, and can also determine which procedures will and will not be permitted) are simply too great. Rather than banning it, we need to be working towards making abortion pretty much unneccesary. This is much harder to do than simply banning it, but does have the advantage of actually solving the problems posed both by allowing and by prohibiting abortion rather than just ignoring them."
2,"I don’t care to debate nor discuss your convoluted justifications for destroying a human fetus or embryo. My question to you: Why did your mother not destroy you while you were nothing but a cellular glob?Answer: Because your mother, and probably your father, loved you more than they loved themselves!!!!!!!!!!!!!!!!!!!Hypocrite! You are ready to justify the killing of human fetuses, while at the same time ignorant of the fact that ‘your’ bullshit argument is possible by reason of your mother’s refusal to kill you while your were nothing but a cellular glob! A female like you who is willing to justify the most cowardice of crimes against her own would-be progeny will commit any manner of crime against her own offspring. So, I think you should make certain that no cellular glob that is human in nature should ever be allowed to grow within your womb, for any child that is born of your matrix will most likely be sacrificed for your own selfish benefit.This is no argument!! Why, because, you have confessed to the innocence of killing your own would-be progeny. Down-vote all of my arguments! It still will not change the fact of your willingness to advocate not only the killing of all human fetuses (yes, all human fetuses), but the killing of your own would-be children. Go ahead! Justify yourself, for your response is nothing more than a self-justification via the state agreeing with you that should kill your un-born progeny. Oh, I can say much more about females such as you. Please, provoke me!BTW, how many children have you given birth to?"
1,"""I don’t care to debate""Then STFU!!! What the hell are you even doing on a site titled ""create debate"" then?..............................................................."
2,I don’t care to debate nor discuss your convoluted justifications for destroying a human fetus or embryo. Don't abstract a fragment of a statement for your propaganda.Pick and choose what you want in order to justify yourself?Do you work for FoxNews?
2,"What the hell are you even doing on a site titled ""create debate"" then?Correcting criminals like yourself that think a debate justifies your criminal intention!Silly criminal, debates are for just persons with just intentions, not criminals with crime in the seared conscience!STFU? Create Debate is not a forum for justifying the unjustifiable. Create Debate is a debating format for rational thought. Killing an un-born fetus cannot be rationalized! So, why do you stretch the intention of debate? I know! You are justifying your intent!Justifying the undebatable with debate! You are still a criminal!"
1,"Typical. You didn't come for a debate, you came for a fight. Debates are for people interested in listening to both sides and expecting to get out of it with a better understanding of the world. You came to ""correct"" people, not to understand other points of view.The undebatable? There's no such thing. Every issue is debatable. It's true that some have stronger arguments on one side than the other, but this shouldn't bother the rational person you claim to be."
